{
  "schema": 2,
  "device": "iPad7,11",
  "ipsw": {
    "version": "18.7.11",
    "build": "22H384",
    "url": "https://updates.cdn-apple.com/2026WinterFCS/cae87706-e21d-4989-a880-3210b045ef28/iPad_10.2_18.7.11_22H384_Restore.ipsw",
    "bytes": 7891326747,
    "sha256": "579973d0a5bbbe6b8c47ffaa8ccf05b30ace59f984d885c0675074d1f877b571"
  },
  "inputs": {
    "ruddera.trx": {
      "ipsw": {
        "rootfs": "System/Library/DriverExtensions/com.apple.DriverKit-AppleBCMWLAN.dext/Firmware/C-4355__s-C1/ruddera.trx"
      },
      "device": "/System/Library/DriverExtensions/com.apple.DriverKit-AppleBCMWLAN.dext/Firmware/C-4355__s-C1/ruddera.trx",
      "sha256": "7654f7777489df7e9f6c3cc648facdb7fb62bdbadc3bdb0dae7ef805a6d7a6ce"
    },
    "ruddera.clmb": {
      "ipsw": {
        "rootfs": "System/Library/DriverExtensions/com.apple.DriverKit-AppleBCMWLAN.dext/Firmware/C-4355__s-C1/ruddera.clmb"
      },
      "device": "/System/Library/DriverExtensions/com.apple.DriverKit-AppleBCMWLAN.dext/Firmware/C-4355__s-C1/ruddera.clmb",
      "sha256": "088d6838473e662e4262af117d5c7b0b5133655684e1a4648656b9014c485f3d"
    },
    "ruddera.txcb": {
      "ipsw": {
        "rootfs": "System/Library/DriverExtensions/com.apple.DriverKit-AppleBCMWLAN.dext/Firmware/C-4355__s-C1/ruddera.txcb"
      },
      "device": "/System/Library/DriverExtensions/com.apple.DriverKit-AppleBCMWLAN.dext/Firmware/C-4355__s-C1/ruddera.txcb",
      "sha256": "c7506618673f9dd60b035bb5abde3fd4989c3e97c23758f44a1cc82a2fda86a9"
    },
    "P-ruddera_M-YSBC_V-u__m-4.3.txt": {
      "ipsw": {
        "rootfs": "System/Library/DriverExtensions/com.apple.DriverKit-AppleBCMWLAN.dext/Firmware/C-4355__s-C1/P-ruddera_M-YSBC_V-u__m-4.3.txt"
      },
      "device": "/System/Library/DriverExtensions/com.apple.DriverKit-AppleBCMWLAN.dext/Firmware/C-4355__s-C1/P-ruddera_M-YSBC_V-u__m-4.3.txt",
      "sha256": "32dc6cb5da0a9ebc4683536fc6af70e42ee39c88358d6ba134e1d9702ac26dcf"
    },
    "P-ruddera_M-YSBC_V-m__m-2.5.txt": {
      "ipsw": {
        "rootfs": "System/Library/DriverExtensions/com.apple.DriverKit-AppleBCMWLAN.dext/Firmware/C-4355__s-C1/P-ruddera_M-YSBC_V-m__m-2.5.txt"
      },
      "device": "/System/Library/DriverExtensions/com.apple.DriverKit-AppleBCMWLAN.dext/Firmware/C-4355__s-C1/P-ruddera_M-YSBC_V-m__m-2.5.txt",
      "sha256": "c1942090e8cf004640b08600aa6830f9e8ba0785717dfbb99c1272af1fb9c99d"
    },
    "kernelcache": {
      "ipsw": {
        "kernelcache": true
      },
      "device": {
        "kernelcache": "active"
      }
    },
    "BlueTool": {
      "ipsw": {
        "rootfs": "usr/sbin/BlueTool"
      },
      "device": "/usr/sbin/BlueTool"
    },
    "J171_Multitouch.im4p": {
      "ipsw": {
        "zip": "Firmware/J171_Multitouch.im4p"
      },
      "sha256": "159f75dbbbf694a47af0fa16d00f2cbf3cf9a3dd34bfdb8da5db1d167a3e9889"
    }
  },
  "outputs": [
    {
      "destination": "lib/firmware/brcm/brcmfmac4355c1-pcie.apple,rudderb.bin",
      "sha256": "7654f7777489df7e9f6c3cc648facdb7fb62bdbadc3bdb0dae7ef805a6d7a6ce",
      "steps": [
        {
          "step": "copy@1",
          "input": "ruddera.trx"
        }
      ]
    },
    {
      "destination": "lib/firmware/brcm/brcmfmac4355c1-pcie.apple,rudderb.clm_blob",
      "sha256": "088d6838473e662e4262af117d5c7b0b5133655684e1a4648656b9014c485f3d",
      "steps": [
        {
          "step": "copy@1",
          "input": "ruddera.clmb"
        }
      ]
    },
    {
      "destination": "lib/firmware/brcm/brcmfmac4355c1-pcie.apple,rudderb.txcap_blob",
      "sha256": "c7506618673f9dd60b035bb5abde3fd4989c3e97c23758f44a1cc82a2fda86a9",
      "steps": [
        {
          "step": "copy@1",
          "input": "ruddera.txcb"
        }
      ]
    },
    {
      "destination": "lib/firmware/brcm/brcmfmac4355c1-pcie.apple,rudderb-YSBC-u-4.3.txt",
      "sha256": "32dc6cb5da0a9ebc4683536fc6af70e42ee39c88358d6ba134e1d9702ac26dcf",
      "steps": [
        {
          "step": "copy@1",
          "input": "P-ruddera_M-YSBC_V-u__m-4.3.txt"
        }
      ]
    },
    {
      "destination": "lib/firmware/brcm/brcmfmac4355c1-pcie.apple,rudderb-YSBC-m-2.5.txt",
      "sha256": "c1942090e8cf004640b08600aa6830f9e8ba0785717dfbb99c1272af1fb9c99d",
      "steps": [
        {
          "step": "copy@1",
          "input": "P-ruddera_M-YSBC_V-m__m-2.5.txt"
        }
      ]
    },
    {
      "destination": "lib/firmware/apple/t8010-smartio.bin",
      "sha256": "71d274a106f5912ed33552ba75ae76cc5081fc7063935ec938f9cb503df38199",
      "steps": [
        {
          "step": "smartio-from-kernelcache@1",
          "input": "kernelcache"
        }
      ]
    },
    {
      "destination": "lib/firmware/brcm/BCM.apple,j171-MUR.hcd",
      "sha256": "d941e18c6501933d2fd1f81a7498fc02755e798caba00f3dd42afd1f255e7188",
      "steps": [
        {
          "step": "bluetool-hcd@1",
          "input": "BlueTool"
        }
      ]
    },
    {
      "destination": "lib/firmware/brcm/BCM.apple,j171-USI.hcd",
      "sha256": "cbae20e838affb3e77939dfaaee6c8d9b963eaf9fb4c6a7d8f3a9bb89a79195d",
      "steps": [
        {
          "step": "bluetool-hcd@1",
          "input": "BlueTool"
        }
      ]
    },
    {
      "destination": "lib/firmware/apple/dfrmtfw-j172-k1f19-6.bin",
      "sha256": "898b9848c68c1b086c824456ad20ab3a5a1f23e375190819544af9c2bac6bd90",
      "steps": [
        {
          "step": "im4p-payload@1",
          "input": "J171_Multitouch.im4p"
        },
        {
          "step": "z2fw-from-mtfw@1",
          "profile": "K1F19,6",
          "otp_preflight": true
        }
      ]
    }
  ]
}
